{
  "$schema": "http://json-schema.org/draft-04/schema#",
  "description": "A compact summary of an instance and derived inventory facts",
  "javaType": "org.folio.rest.jaxrs.model.InstanceSummary",
  "type": "object",
  "properties": {
    "instance": {
      "description": "Instance record being summarized",
      "$ref": "instance.json"
    },
    "isBoundWith": {
      "description": "Whether any holdings for the instance are part of a bound-with relationship",
      "type": "boolean"
    },
    "recordCounts": {
      "type": "object",
      "description": "Counts that allow consumers to apply their own suppression policy",
      "additionalProperties": false,
      "properties": {
        "holdings": {
          "description": "Counts for holdings records associated with the instance",
          "type": "object",
          "additionalProperties": false,
          "properties": {
            "total": {
              "description": "Total number of holdings records associated with the instance",
              "type": "integer"
            },
            "suppressedFromDiscovery": {
              "description": "Number of holdings records suppressed from discovery",
              "type": "integer"
            },
            "notSuppressedFromDiscovery": {
              "description": "Number of holdings records not suppressed from discovery",
              "type": "integer"
            }
          },
          "required": [
            "total",
            "suppressedFromDiscovery",
            "notSuppressedFromDiscovery"
          ]
        },
        "items": {
          "description": "Counts for item records associated with the instance",
          "type": "object",
          "additionalProperties": false,
          "properties": {
            "total": {
              "description": "Total number of item records associated with the instance",
              "type": "integer"
            },
            "suppressedFromDiscovery": {
              "description": "Number of item records directly suppressed from discovery",
              "type": "integer"
            },
            "suppressedByHoldings": {
              "description": "Number of item records associated with holdings suppressed from discovery",
              "type": "integer"
            },
            "suppressedFromDiscoveryOrByHoldings": {
              "description": "Number of item records directly suppressed from discovery or associated with suppressed holdings",
              "type": "integer"
            },
            "notSuppressedFromDiscovery": {
              "description": "Number of item records not directly suppressed from discovery and not associated with suppressed holdings",
              "type": "integer"
            }
          },
          "required": [
            "total",
            "suppressedFromDiscovery",
            "suppressedByHoldings",
            "suppressedFromDiscoveryOrByHoldings",
            "notSuppressedFromDiscovery"
          ]
        }
      },
      "required": [
        "holdings",
        "items"
      ]
    },
    "aggregates": {
      "type": "object",
      "description": "Aggregate facts for all records and for records not suppressed from discovery",
      "additionalProperties": false,
      "properties": {
        "allRecords": {
          "description": "Aggregate facts calculated from all holdings and item records",
          "$ref": "#/definitions/aggregateScope"
        },
        "notSuppressedFromDiscoveryRecords": {
          "description": "Aggregate facts calculated from holdings and item records not suppressed from discovery",
          "$ref": "#/definitions/aggregateScope"
        }
      },
      "required": [
        "allRecords",
        "notSuppressedFromDiscoveryRecords"
      ]
    },
    "referenceValues": {
      "type": "object",
      "description": "Instance-level reference values useful to consumers",
      "additionalProperties": false,
      "properties": {
        "instanceFormats": {
          "description": "Instance format reference values for the instance",
          "type": "array",
          "items": {
            "$ref": "#/definitions/namedValue"
          }
        },
        "modeOfIssuance": {
          "description": "Mode of issuance reference value for the instance",
          "$ref": "#/definitions/namedValue"
        },
        "natureOfContentTerms": {
          "description": "Nature of content term reference values for the instance",
          "type": "array",
          "items": {
            "$ref": "#/definitions/namedValue"
          }
        },
        "instanceType": {
          "description": "Instance type reference value for the instance",
          "$ref": "#/definitions/namedValue"
        }
      },
      "required": [
        "instanceFormats",
        "natureOfContentTerms",
        "instanceType"
      ]
    }
  },
  "additionalProperties": false,
  "required": [
    "instance",
    "isBoundWith",
    "recordCounts",
    "aggregates",
    "referenceValues"
  ],
  "definitions": {
    "aggregateScope": {
      "type": "object",
      "additionalProperties": false,
      "properties": {
        "itemDerivedFields": {
          "description": "Fields derived from item records without returning item rows",
          "type": "object",
          "additionalProperties": false,
          "properties": {
            "effectiveShelvingOrder": {
              "description": "First item effective shelving order in this aggregate scope, if available",
              "type": [
                "string",
                "null"
              ]
            }
          },
          "required": [
            "effectiveShelvingOrder"
          ]
        },
        "electronicAccess": {
          "type": "array",
          "description": "Deduplicated electronic access entries from the instance, holdings, and items",
          "items": {
            "type": "object",
            "additionalProperties": true
          }
        },
        "referenceValues": {
          "description": "Reference values derived from records in this aggregate scope",
          "type": "object",
          "additionalProperties": false,
          "properties": {
            "itemMaterialTypes": {
              "description": "Material type reference values represented by items in this aggregate scope",
              "type": "array",
              "items": {
                "$ref": "#/definitions/namedValue"
              }
            }
          },
          "required": [
            "itemMaterialTypes"
          ]
        }
      },
      "required": [
        "itemDerivedFields",
        "electronicAccess",
        "referenceValues"
      ]
    },
    "namedValue": {
      "type": "object",
      "additionalProperties": false,
      "properties": {
        "id": {
          "description": "Reference value identifier",
          "type": "string"
        },
        "name": {
          "description": "Reference value display name",
          "type": "string"
        }
      },
      "required": [
        "id",
        "name"
      ]
    }
  }
}
